{
  "decisions_reviewed": [
    "planner_handoff.decisions"
  ],
  "evidence_refs": [
    "scanner_handoff.json",
    "aggregation_handoff.json",
    "backtest_handoff.json",
    "market_context_handoff.json",
    "planner_handoff.json",
    "realized_outcomes.json",
    "outcome_health.json",
    "profile_diagnostics.json"
  ],
  "failure_summary": "No critical pre-outcome failure. Postmortem generated as a preventive trace.",
  "likely_causes": [],
  "produced_at": "2026-04-07T23:06:50.043902+00:00",
  "run_context": {
    "as_of_date": "2026-04-08",
    "code_version": "bridge-v1",
    "created_at": "2026-04-07T23:06:44.735800+00:00",
    "market": "KOSDAQ",
    "model_version": "legacy",
    "run_id": "RUN-9E3D20C6",
    "strategy_version": "legacy-ui-v1"
  },
  "scope": "pre_outcome_quality_gate",
  "tickets": []
}