{
  "decisions_reviewed": [
    "planner_handoff.decisions"
  ],
  "evidence_refs": [
    "scanner_handoff.json",
    "aggregation_handoff.json",
    "backtest_handoff.json",
    "market_context_handoff.json",
    "planner_handoff.json",
    "realized_outcomes.json",
    "outcome_health.json",
    "profile_diagnostics.json"
  ],
  "failure_summary": "No critical pre-outcome failure. Postmortem generated as a preventive trace.",
  "likely_causes": [
    "Learned market policy downgraded planner to watchlist-only (NASDAQ/GREEN, mode=avoid)."
  ],
  "produced_at": "2026-04-01T15:12:49.716994+00:00",
  "run_context": {
    "as_of_date": "2026-04-02",
    "code_version": "bridge-v1",
    "created_at": "2026-04-01T15:12:30.299769+00:00",
    "market": "NASDAQ",
    "model_version": "legacy",
    "run_id": "RUN-82CD689A",
    "strategy_version": "legacy-ui-v1"
  },
  "scope": "pre_outcome_quality_gate",
  "tickets": [
    {
      "created_at": "2026-04-01T15:12:49.716975+00:00",
      "hypothesis": "Planner is suppressing active recommendations because the learned market/regime bucket is currently avoid.",
      "owner_agent": "pm_planner_agent",
      "owner_module": "planner policy + regime scan policy",
      "priority": "medium",
      "requested_change": "Validate whether watchlist-only mode is appropriate for this market/regime bucket and retrain policy once more realized outcomes accumulate.",
      "run_id": "RUN-82CD689A",
      "status": "open",
      "ticket_id": "TKT-46C2D208",
      "title": "Review watchlist-only market policy coverage"
    }
  ]
}