{
  "decisions_reviewed": [
    "planner_handoff.decisions"
  ],
  "evidence_refs": [
    "scanner_handoff.json",
    "aggregation_handoff.json",
    "backtest_handoff.json",
    "market_context_handoff.json",
    "planner_handoff.json",
    "realized_outcomes.json",
    "outcome_health.json",
    "profile_diagnostics.json"
  ],
  "failure_summary": "Pre-outcome quality risk detected. See tickets for agent-specific fixes.",
  "likely_causes": [
    "Scanner produced zero candidates; filter or data pipeline mismatch is likely.",
    "Sample size is small; confidence may be overstated."
  ],
  "produced_at": "2026-04-01T14:30:29.889054+00:00",
  "run_context": {
    "as_of_date": "2026-04-01",
    "code_version": "amex-moonshot-cycle",
    "created_at": "2026-04-01T14:30:26.514096+00:00",
    "market": "AMEX",
    "model_version": "amex-research-baseline",
    "run_id": "RUN-E094BE7B",
    "strategy_version": "amex-moonshot-v1"
  },
  "scope": "pre_outcome_quality_gate",
  "tickets": [
    {
      "created_at": "2026-04-01T14:30:29.889019+00:00",
      "hypothesis": "Threshold coupling or upstream data fetch failures can collapse candidate output.",
      "owner_agent": "scanner_agent",
      "owner_module": "app.py|auto_bot.py scanner bridge",
      "priority": "high",
      "requested_change": "Add per-filter reject counters and surface them in scanner_trace.",
      "run_id": "RUN-E094BE7B",
      "status": "open",
      "ticket_id": "TKT-DD55939B",
      "title": "Investigate zero-candidate scan runs"
    },
    {
      "created_at": "2026-04-01T14:30:29.889032+00:00",
      "hypothesis": "Current run size is insufficient for stable inference.",
      "owner_agent": "backtest_learning_agent",
      "owner_module": "backtest diagnostics",
      "priority": "medium",
      "requested_change": "Attach sample-size penalty to planner confidence and show warning banner.",
      "run_id": "RUN-E094BE7B",
      "status": "open",
      "ticket_id": "TKT-77B0A0B0",
      "title": "Strengthen small-sample safeguards"
    }
  ]
}