{
  "decisions_reviewed": [
    "planner_handoff.decisions"
  ],
  "evidence_refs": [
    "scanner_handoff.json",
    "aggregation_handoff.json",
    "backtest_handoff.json",
    "market_context_handoff.json",
    "planner_handoff.json",
    "realized_outcomes.json",
    "outcome_health.json",
    "profile_diagnostics.json"
  ],
  "failure_summary": "Pre-outcome quality risk detected. See tickets for agent-specific fixes.",
  "likely_causes": [
    "Scanner produced zero candidates; filter or data pipeline mismatch is likely.",
    "Sample size is small; confidence may be overstated.",
    "Prod profile has repeated zero-result runs and requires immediate fallback policy."
  ],
  "produced_at": "2026-03-31T07:22:48.141077+00:00",
  "run_context": {
    "as_of_date": "2026-03-31",
    "code_version": "non-ui-scan-v1",
    "created_at": "2026-03-31T07:22:41.997813+00:00",
    "market": "KOSDAQ",
    "model_version": "legacy",
    "run_id": "RUN-6DBB680B",
    "strategy_version": "legacy-cli-v1"
  },
  "scope": "pre_outcome_quality_gate",
  "tickets": [
    {
      "created_at": "2026-03-31T07:22:48.141042+00:00",
      "hypothesis": "Threshold coupling or upstream data fetch failures can collapse candidate output.",
      "owner_agent": "scanner_agent",
      "owner_module": "app.py|auto_bot.py scanner bridge",
      "priority": "high",
      "requested_change": "Add per-filter reject counters and surface them in scanner_trace.",
      "run_id": "RUN-6DBB680B",
      "status": "open",
      "ticket_id": "TKT-4D4E2719",
      "title": "Investigate zero-candidate scan runs"
    },
    {
      "created_at": "2026-03-31T07:22:48.141051+00:00",
      "hypothesis": "Current run size is insufficient for stable inference.",
      "owner_agent": "backtest_learning_agent",
      "owner_module": "backtest diagnostics",
      "priority": "medium",
      "requested_change": "Attach sample-size penalty to planner confidence and show warning banner.",
      "run_id": "RUN-6DBB680B",
      "status": "open",
      "ticket_id": "TKT-06D9340C",
      "title": "Strengthen small-sample safeguards"
    },
    {
      "created_at": "2026-03-31T07:22:48.141061+00:00",
      "hypothesis": "Fallback watchlist is now active but still needs explicit risk caps and expiry rules.",
      "owner_agent": "pm_planner_agent",
      "owner_module": "planner policy / fallback mode",
      "priority": "high",
      "requested_change": "Enforce fallback expiry in outcome-tracking jobs and alert when stale fallback rows accumulate.",
      "run_id": "RUN-6DBB680B",
      "status": "open",
      "ticket_id": "TKT-102DD9BB",
      "title": "Harden fallback watchlist governance in prod"
    }
  ]
}